{
  "schema_version": "1.0",
  "experiment_id": "fixed-hybrid-profiler-validation",
  "hybrid_config": {
    "path": "/absolute/path/hybrid-config.json",
    "sha256": "0000000000000000000000000000000000000000000000000000000000000000"
  },
  "schedule": {
    "seed": 20260807,
    "max_hardware_attempts": 42
  }
}
